<?xml version="1.0" encoding="UTF-8" ?>
<!DOCTYPE persons SYSTEM "english.dtd">
<persons>
    <person>
        <email>katia@mail.ru</email>
        <nickname>k_den11</nickname>
        <password>qwerty12345</password>
        <themes>
            <theme>
                <name>Animals</name>
                <lessons>
                    <lesson>
                        <name>Animals read</name>
                        <theory> some theory(lions live 10 years)</theory>
                        <test>
                            <questions>
                                <question>
                                    <nameQuestion>lions live 10 years</nameQuestion>
                                    <answers>
                                        <answer>10 years</answer>
                                        <answer>2 years</answer>
                                    </answers>
                                </question>

                            </questions>

                        </test>
                    </lesson>
                </lessons>
            </theme>
        </themes>
    </person>
</persons>
